name,party,constituency,county,status,image_local_path
"HON. MEJJADONK, BENJAMIN GATHIRU",UDA,EMBAKASI CENTRAL,NAIROBI,Elected,images/mps/HON_MEJJADONK_BENJAMIN_GATHIRU.jpg
HON. (AMB.) LANGAT BENJAMIN KIPKIRUI,UDA,AINAMOI,KERICHO,Elected,images/mps/HON_AMB_LANGAT_BENJAMIN_KIPKIRUI.JPG
HON. (DR.) GICHUKI EDWIN MUGO,UDA,MATHIOYA,MURANGÁ,Elected,images/mps/HON_DR_GICHUKI_EDWIN_MUGO.jpg
HON. (DR.) JACKSON KIPKEMOI KOSGEI,UDA,,,Nominated,images/mps/HON_DR_JACKSON_KIPKEMOI_KOSGEI.jpg
HON. (DR.) MUTUNGA JOHN KANYUITHIA,UDA,TIGANIA WEST,MERU,Elected,images/mps/HON_DR_MUTUNGA_JOHN_KANYUITHIA.jpg
HON. (DR.) PUKOSE ROBERT,UDA,ENDEBESS,TRANS NZOIA,Elected,images/mps/HON_DR_PUKOSE_ROBERT.jpg
HON. (ENG.) NZAMBIA KITHUA THUDDEUS,WDM,KILOME,MAKUENI,Elected,images/mps/HON_ENG_NZAMBIA_KITHUA_THUDDEUS.jpg
HON. ABDI ALI ABDI,NAP-K,IJARA,GARISSA,Elected,images/mps/HON_ABDI_ALI_ABDI.jpg
HON. ABDI KHAMIS CHOME,WDM,VOI,TAITA TAVETA,Elected,images/mps/HON_ABDI_KHAMIS_CHOME.jpg
"HON. ABDI, YUSUF HASSAN",JP,KAMKUNJI,NAIROBI,Elected,images/mps/HON_ABDI_YUSUF_HASSAN.jpg
HON. ABDIRAHMAN MOHAMED ABDI,JP,LAFEY,MANDERA,Elected,images/mps/HON_ABDIRAHMAN_MOHAMED_ABDI.jpg
"HON. ABDIRAHMAN, HUSSEINWEYTAN MOHAMED",ODM,MANDERA EAST,MANDERA,Elected,images/mps/HON_ABDIRAHMAN_HUSSEINWEYTAN_MOHAMED.jpg
HON. ABDULLAHI AMINA DIKA,KANU,TANA RIVER,TANA RIVER,Elected,images/mps/HON_ABDULLAHI_AMINA_DIKA.jpg
HON. ABDULLAIH BASHIR SHEIKH,UDM,MANDERA NORTH,MANDERA,Elected,images/mps/HON_ABDULLAIH_BASHIR_SHEIKH.jpg
HON. ABUBAKAR TALIB AHMED,WDM,,,Nominated,images/mps/HON_ABUBAKAR_TALIB_AHMED.jpg
HON. ABUOR PAUL,ODM,RONGO,MIGORI,Elected,images/mps/HON_ABUOR_PAUL.jpg
HON. ABURI DONYA DORICE,WDM,KISII,KISII,Elected,images/mps/HON_ABURI_DONYA_DORICE.jpg
"HON. ABURI, LAWRENCE MPURU",NOPEU,TIGANIA EAST,MERU,Elected,images/mps/HON_ABURI_LAWRENCE_MPURU.jpg
"HON. ADAGALA, BEATRICE KAHAI",ANC,VIHIGA,VIHIGA,Elected,images/mps/HON_ADAGALA_BEATRICE_KAHAI.jpg
HON. ADHE WARIO GUYO,KANU,NORTH HORR,MARSABIT,Elected,images/mps/HON_ADHE_WARIO_GUYO.jpg
HON. ADOW ADEN MOHAMMED,ODM,WAJIR SOUTH,WAJIR,Elected,images/mps/HON_ADOW_ADEN_MOHAMMED.jpg
HON. AHMED SHAKEEL AHMED SHABBIR,IND.,KISUMU EAST,KISUMU,Elected,images/mps/HON_AHMED_SHAKEEL_AHMED_SHABBIR.jpg
"HON. AKUJAH, PROTUS EWESIT",UDA,LOIMA,TURKANA,Elected,images/mps/HON_AKUJAH_PROTUS_EWESIT.jpg
HON. ALFAH ONDIEKI MIRUKA,UDA,BOMACHOGE CHACHE,KISII,Elected,images/mps/HON_ALFAH_ONDIEKI_MIRUKA.jpg
HON. ALI ABDISIRAT KHALIF,UDA,,,Nominated,images/mps/HON_ALI_ABDISIRAT_KHALIF.jpg
HON. AMOLLO PAUL OTIENDE,ODM,RARIEDA,SIAYA,Elected,images/mps/HON_AMOLLO_PAUL_OTIENDE.jpeg
HON. ARAMA SAMUEL,JP,NAKURU TOWN WEST,NAKURU,Elected,images/mps/HON_ARAMA_SAMUEL.jpg
HON. ARIKO JOHN NAMOIT,ODM,TURKANA SOUTH,TURKANA,Elected,images/mps/HON_ARIKO_JOHN_NAMOIT.jpg
HON. ATANDI SAMUEL ONUNGA,ODM,ALEGO USONGA,SIAYA,Elected,images/mps/HON_ATANDI_SAMUEL_ONUNGA.jpg
HON. BABU OWINO PAUL ONGILI,ODM,EMBAKASI EAST,NAIROBI,Elected,images/mps/HON_BABU_OWINO_PAUL_ONGILI.jpg
HON. BADY BADY TWALIB,ODM,JOMVU,MOMBASA,Elected,images/mps/HON_BADY_BADY_TWALIB.jpg
HON. BARASA PATRICK SIMIYU,DAP-K,CHERANGANY,TRANS NZOIA,Elected,images/mps/HON_BARASA_PATRICK_SIMIYU.jpg
HON. BARONGO NOLFASON OBADIAH,ODM,BOMACHOGE BORABU,KISII,Elected,images/mps/HON_BARONGO_NOLFASON_OBADIAH.jpg
HON. BARRE HUSSEIN ABDI,UDA,TARBAJ,WAJIR,Elected,images/mps/HON_BARRE_HUSSEIN_ABDI.jpg
HON. BARTOO PHYLIS JEPKEMOI,UDA,MOIBEN,UASIN GISHU,Elected,images/mps/HON_BARTOO_PHYLIS_JEPKEMOI.jpg
HON. BASIL ROBERT NGUI,WDM,YATTA,MACHAKOS,Elected,images/mps/HON_BASIL_ROBERT_NGUI.jpg
HON. BAYA OWEN YAA,UDA,KILIFI NORTH,KILIFI,Elected,images/mps/HON_BAYA_OWEN_YAA.jpg
HON. BEDZIMBA RASHID JUMA,ODM,KISAUNI,MOMBASA,Elected,images/mps/HON_BEDZIMBA_RASHID_JUMA.jpg
"HON. BIDU, MOHAMED TUBI",JP,ISIOLO SOUTH,ISIOLO,Elected,images/mps/HON_BIDU_MOHAMED_TUBI.jpg
HON. BIEGO PAUL KIBICHIY,UDA,CHESUMEI,NANDI,Elected,images/mps/HON_BIEGO_PAUL_KIBICHIY.JPG
"HON. BISAU, MAURICE KAKAI",DAP-K,KIMININI,TRANS-NZOIA,Elected,images/mps/HON_BISAU_MAURICE_KAKAI.png
HON. BONAYA MUMINA GOLLO,JP,ISIOLO,ISIOLO,Elected,images/mps/HON_BONAYA_MUMINA_GOLLO.jpg
HON. BOSS GLADYS JEPKOSGEI,UDA,UASIN GISHU,UASIN GISHU,Elected,images/mps/HON_BOSS_GLADYS_JEPKOSGEI.jpg
HON. BOWEN DAVID KANGOGO,UDA,MARAKWET EAST,ELGEYO-MARAKWET,Elected,images/mps/HON_BOWEN_DAVID_KANGOGO.jpg
HON. BUSIA RUTH ADHIAMBO ODINGA,ODM,KISUMU,KISUMU,Elected,images/mps/HON_BUSIA_RUTH_ADHIAMBO_ODINGA.jpg
HON. BUYU ROZAAH AKINYI,ODM,KISUMU WEST,KISUMU,Elected,images/mps/HON_BUYU_ROZAAH_AKINYI.jpg
HON. BWIRE JOHN OKANO,WDM,TAVETA,TAITA TAVETA,Elected,images/mps/HON_BWIRE_JOHN_OKANO.jpg
"HON. CHEBOR, PAUL KIBET",UDA,RONGAI,NAKURU,Elected,images/mps/HON_CHEBOR_PAUL_KIBET.jpg
HON. CHEGE JOHN KIRAGU,UDA,LIMURU,KIAMBU,Elected,images/mps/HON_CHEGE_JOHN_KIRAGU.jpg
HON. CHEGE NJUGUNA,UDA,KANDARA,MURANG'A,ELECTED,images/mps/HON_CHEGE_NJUGUNA.jpg
HON. CHEGE SABINA WANJIRU,JP,,,Nominated,images/mps/HON_CHEGE_SABINA_WANJIRU.jpg
"HON. CHELULE, LIZA CHEPKORIR",UDA,NAKURU,NAKURU,Elected,images/mps/HON_CHELULE_LIZA_CHEPKORIR.jpg
"HON. CHEPKONGA, SAMUEL KIPRONO",UDA,AINABKOI,UASIN GISHU,Elected,images/mps/HON_CHEPKONGA_SAMUEL_KIPRONO.jpg
"HON. CHEPKORIR, LINET",UDA,BOMET,BOMET,Elected,images/mps/HON_CHEPKORIR_LINET.jpg
HON. CHEPKWONY CHARITY KATHAMBI,UDA,NJORO,NAKURU,Elected,images/mps/HON_CHEPKWONY_CHARITY_KATHAMBI.jpg
HON. CHEROROT JOSEPH KIMUTAI,UDA,KIPKELION EAST,KERICHO,Elected,images/mps/HON_CHEROROT_JOSEPH_KIMUTAI.jpg
HON. CHESEBE FRED KAPONDI,UDA,MT. ELGON,BUNGOMA,UDA,images/mps/HON_CHESEBE_FRED_KAPONDI.jpg
"HON. CHIFOROMODO, MANGALE MUNGA",UDM,LUNGA LUNGA,KWALE,Elected,images/mps/HON_CHIFOROMODO_MANGALE_MUNGA.jpg
HON. CHIKATI JOHN MURUMBA,FORD-K,TONGAREN,BUNGOMA,Elected,images/mps/HON_CHIKATI_JOHN_MURUMBA.jpg
"HON. CHUMEL, MOROTO SAMUEL",UDA,KAPENGURIA,WEST POKOT,Elected,images/mps/HON_CHUMEL_MOROTO_SAMUEL.jpg
HON. CPA RUTTO JULIUS KIPLETTING,UDA,KESSES,UASIN GISHU,Elected,images/mps/HON_CPA_RUTTO_JULIUS_KIPLETTING.jpg
"HON. DAWOOD, ABDUL RAHIM",IND,NORTH IMENTI,MERU,Elected,images/mps/HON_DAWOOD_ABDUL_RAHIM.jpg
HON. DENA JOSEPH HAMISI,ANC,,,Nominated,images/mps/HON_DENA_JOSEPH_HAMISI.jpg
HON. EKWOM NABUIN,ODM,TURKANA NORTH,TURKANA,Elected,images/mps/HON_EKWOM_NABUIN.jpg
HON. ELACHI BEATRICE KADEVERESIA,ODM,DAGORETTI NORTH,NAIROBI,Elected,images/mps/HON_ELACHI_BEATRICE_KADEVERESIA.jpg
HON. ERIC WAMUMBI,UDA,MATHIRA,NYERI,Elected,images/mps/HON_ERIC_WAMUMBI.jpg
HON. FARAH SALAH YAKUB,UDA,FAFI,GARISSA,Elected,images/mps/HON_FARAH_SALAH_YAKUB.jpg
HON. FARAH YUSSUF MOHAMED,ODM,WAJIR WEST,WAJIR,Elected,images/mps/HON_FARAH_YUSSUF_MOHAMED.jpg
HON. GACHAGUA GEORGE,UDA,NDARAGWA,NYANDARUA,Elected,images/mps/HON_GACHAGUA_GEORGE.jpg
HON. GACHOBE SAMUEL KINUTHIA,UDA,SUBUKIA,NAKURU,Elected,images/mps/HON_GACHOBE_SAMUEL_KINUTHIA.jpg
HON. GAKUYA JAMES MWANGI,UDA,EMBAKASSI NORTH,NAIROBI,Elected,images/mps/HON_GAKUYA_JAMES_MWANGI.jpg
HON. GIDEON KIMAIYO,UDA,KEIYO SOUTH,ELGEYO-MARAKWET,Elected,images/mps/HON_GIDEON_KIMAIYO.jpg
"HON. GIKARIA, DAVID",UDA,NAKURU TOWN EAST,NAKURU,Elected,images/mps/HON_GIKARIA_DAVID.jpg
"HON. GIMOSE, CHARLES GUMINI",ANC,HAMISI,VIHIGA,Elected,images/mps/HON_GIMOSE_CHARLES_GUMINI.jpg
HON. GISAIRO CLIVE OMBANE,ODM,KITUTU MASABA,NYAMIRA,Elected,images/mps/HON_GISAIRO_CLIVE_OMBANE.jpg
"HON. GITARI, JOSEPH GACHOKI",UDA,KIRINYAGA CENTRAL,KIRINYAGA,Elected,images/mps/HON_GITARI_JOSEPH_GACHOKI.jpg
HON. GITAU FAITH WAIRIMU,UDA,NYANDARUA,NYANDARUA,Elected,images/mps/HON_GITAU_FAITH_WAIRIMU.jpg
"HON. GITHINJI, ROBERT GICHIMU",UDA,GICHUGU,KIRINYAGA,Elected,images/mps/HON_GITHINJI_ROBERT_GICHIMU.jpg
"HON. GOGO, LILIAN ACHIENG",ODM,RANGWE,HOMA BAY,Elected,images/mps/HON_GOGO_LILIAN_ACHIENG.jpg
HON. GUYO ALI WARIO,ODM,GARSEN,TANA RIVER,Elected,images/mps/HON_GUYO_ALI_WARIO.jpg
HON. HAMISI KAKUTA MAIMAI,ODM,KAJIADO EAST,KAJIADO,Elected,images/mps/HON_HAMISI_KAKUTA_MAIMAI.jpg
HON. HARO ABDUL EBRAHIM,UDM,MANDERA SOUTH,MANDERA,Elected,images/mps/HON_HARO_ABDUL_EBRAHIM.jpg
HON. HASSAN KULOW MAALIM,UDM,BANISSA,MANDERA,Elected,images/mps/HON_HASSAN_KULOW_MAALIM.jpg
HON. HIRIBAE SAID BUYA,ODM,GALOLE,TANA RIVER,Elected,images/mps/HON_HIRIBAE_SAID_BUYA.jpg
HON. ICHUNG’WAH ANTONY KIMANI,UDA,KIKUYU,KIAMBU,Elected,images/mps/HON_ICHUNGWAH_ANTONY_KIMANI.jpg
HON. IKANA FREDRICK LUSULI,ANC,SHINYALU,KAKAMEGA,Elected,images/mps/HON_IKANA_FREDRICK_LUSULI.jpg
"HON. IKIARA, DOROTHY MUTHONI",UDA,,,Nominated,images/mps/HON_IKIARA_DOROTHY_MUTHONI.jpg
HON. ITHINJI SHADRACK MWITI,JP,SOUTH IMENTI,MERU,Elected,images/mps/HON_ITHINJI_SHADRACK_MWITI.jpg
HON. JALDESA GUYO WAQO,UPIA,MOYALE,MARSABIT,Elected,images/mps/HON_JALDESA_GUYO_WAQO.jpg
HON. JEHOW FATUMA ABDI,ODM,WAJIR,WAJIR,Elected,images/mps/HON_JEHOW_FATUMA_ABDI.jpg
HON. JHANDA ZAHEER,UDA,NYARIBARI CHACHE,KISII,Elected,images/mps/HON_JHANDA_ZAHEER.jpg
HON. JOSEPH WAINAINA IRAYA,,,,,images/mps/HON_JOSEPH_WAINAINA_IRAYA.png
HON. JUNET SHEIKH NUH MOHAMED,,,,,images/mps/HON_JUNET_SHEIKH_NUH_MOHAMED.jpg
HON. KAGESI ERNEST OGESI KIVAI,ANC,VIHIGA,VIHIGA,Elected,images/mps/HON_KAGESI_ERNEST_OGESI_KIVAI.jpg
HON. KAGIRI JANE WANGECHI,UDA,LAIKIPIA,LAIKIPIA,Elected,images/mps/HON_KAGIRI_JANE_WANGECHI.jpg
HON. KAGOMBE GABRIEL GATHUKA,UDA,GATUNDU SOUTH,KIAMBU,Elected,images/mps/HON_KAGOMBE_GABRIEL_GATHUKA.jpg
HON. KAGUCHIA JOHN PHILIP GICHOHI,UDA,MUKURWEINI,NYERI,Elected,images/mps/HON_KAGUCHIA_JOHN_PHILIP_GICHOHI.jpg
HON. KAHANGARA JOSEPH MBURU,UDA,LARI,KIAMBU,Elected,images/mps/HON_KAHANGARA_JOSEPH_MBURU.jpg
HON. KAILEMIA ELIZABETH KARAMBU,UDA,MERU,MERU,Elected,images/mps/HON_KAILEMIA_ELIZABETH_KARAMBU.jpg
"HON. KAJWANG’, FRANCIS TOM JOSEPH",ODM,,,ELECT,images/mps/HON_KAJWANG_FRANCIS_TOM_JOSEPH.jpg
HON. KALUMA GEORGE PETER OPONDO,ODM,HOMA BAY TOWN,HOMA BAY,Elected,images/mps/HON_KALUMA_GEORGE_PETER_OPONDO.jpg
"HON. KAMENE, JOYCE",WDM,MACHAKOS,MACHAKOS,Elected,images/mps/HON_KAMENE_JOYCE.jpg
HON. KAMKET KASSAIT WILLIAM,KANU,TIATY,BARINGO,Elected,images/mps/HON_KAMKET_KASSAIT_WILLIAM.jpg
"HON. KAMUREN, CHARLES",UDA,BARINGO SOUTH,BARINGO,Elected,images/mps/HON_KAMUREN_CHARLES.jpg
"HON. KANCHORY, ELIJAH MEMUSI",ODM,KAJIADO CENTRAL,KAJIADO,Elected,images/mps/HON_KANCHORY_ELIJAH_MEMUSI.jpg
"HON. KANDIE, JOSHUA CHEPYEGON",UDA,BARINGO CENTRAL,BARINGO,Elected,images/mps/HON_KANDIE_JOSHUA_CHEPYEGON.jpg
HON. KARANI STEPHEN WACHIRA,UDA,LAIKIPIA WEST,LAIKIPIA,Elected,images/mps/HON_KARANI_STEPHEN_WACHIRA.jpg
"HON. KARAURI, RONALD KAMWIKO",IND,KASARANI,NAIROBI,,images/mps/HON_KARAURI_RONALD_KAMWIKO.jpg
"HON. KAREMBA, ERIC MUCHANGI.N.",UDA,RUNYENJES,EMBU,Elected,images/mps/HON_KAREMBA_ERIC_MUCHANGIN.jpg
HON. KARIUKI GEORGE MACHARIA,UDA,NDIA,KIRINYAGA,Elected,images/mps/HON_KARIUKI_GEORGE_MACHARIA.jpg
"HON. KASALU, IRENE MUTHONI",WDM,KITUI,KITUI,Elected,images/mps/HON_KASALU_IRENE_MUTHONI.jpg
HON. KASIWAI RAEL KASIWAI,KUP,WEST POKOT,WEST POKOT,Elected,images/mps/HON_KASIWAI_RAEL_KASIWAI.jpg
HON. KATANA PAUL KAHINDI,ODM,KALOLENI,KILIFI,Elected,images/mps/HON_KATANA_PAUL_KAHINDI.jpg
HON. KAUNYA EDWARD OKU,ODM,TESO NORTH,BUSIA,Elected,images/mps/HON_KAUNYA_EDWARD_OKU.jpg
HON. KEMEI JUSTICE KIPSANG,UDA,SIGOWET/SOIN,KERICHO,Elected,images/mps/HON_KEMEI_JUSTICE_KIPSANG.jpg
"HON. KEMEI, BEATRICE CHEPNGENO",UDA,KERICHO,KERICHO,Elected,images/mps/HON_KEMEI_BEATRICE_CHEPNGENO.jpg
"HON. KEYNAN, WEHLIYE ADAN",JP,ELDAS,WAJIR,Elected,images/mps/HON_KEYNAN_WEHLIYE_ADAN.jpg
HON. KHAMISI MBOKO MISHI JUMA,ODM,LIKONI,MOMBASA,Elected,images/mps/HON_KHAMISI_MBOKO_MISHI_JUMA.jpg
HON. KHODHE PHELIX ODIWUOR,ODM,LANGATA,NAIROBI,Elected,images/mps/HON_KHODHE_PHELIX_ODIWUOR.jpg
HON. KIAMBA SUZANNE NDUNGE,WDM,MAKUENI,MAKUENI,Elected,images/mps/HON_KIAMBA_SUZANNE_NDUNGE.jpg
"HON. KIARAHO, DAVID NJUGUNA",JP,OL KALOU,NYANDARUA,Elected,images/mps/HON_KIARAHO_DAVID_NJUGUNA.jpg
"HON. KIBAGENDI, ANTONEY",ODM,KITUTU CHACHE SOUTH,KISII,Elected,images/mps/HON_KIBAGENDI_ANTONEY.jpg
"HON. KIHARA, JAYNE N.W",UDA,NAIVASHA,NAKURU,,images/mps/HON_KIHARA_JAYNE_NW.jpg
HON. KIHUNGI PETER IRUNGU,UDA,KANGEMA,MURANGA,Elected,images/mps/HON_KIHUNGI_PETER_IRUNGU.jpg
"HON. KILEL, RICHARD CHERUIYOT",UDA,BOMET CENTRAL,BOMET,,images/mps/HON_KILEL_RICHARD_CHERUIYOT.jpg
"HON. KIMILU, JOSHUA KIVINDA",WDM,KAITI,MAKUENI,Elected,images/mps/HON_KIMILU_JOSHUA_KIVINDA.jpg
HON. KING'OLA PATRICK MAKAU,WDM,MAVOKO,MACHAKOS,Elected,https://f003.backblazeb2.com/file/serikali-images/mps/HON_KINGOLA_PATRICK_MAKAU.webp
"HON. KINGARA, SIMON NGANGA",UDA,RUIRU,KIAMBU,Elected,images/mps/HON_KINGARA_SIMON_NGANGA.jpg
"HON. KIPKOROS, JOSEPH MAKILAP",UDA,BARINGO NORTH,BARINGO,Elected,images/mps/HON_KIPKOROS_JOSEPH_MAKILAP.jpg
HON. KIPLAGAT DAVID,UDA,SOY,UASIN GISHU,Elected,images/mps/HON_KIPLAGAT_DAVID.jpg
"HON. KIPYEGON, JOHANA NGENO",UDA,EMURUA DIKIRR,NAROK,Elected,images/mps/HON_KIPYEGON_JOHANA_NGENO.jpg
HON. KIRIMA MOSES NGUCHINE,UDA,CENTRAL IMENTI,MERU,Elected,images/mps/HON_KIRIMA_MOSES_NGUCHINE.jpg
HON. KIRWA ABRAHAM KIPSANG,UDA,MOSOP,NANDI,Elected,images/mps/HON_KIRWA_ABRAHAM_KIPSANG.png
HON. KITANY MARIANNE,UDA,ALDAI,NANDI,Elected,images/mps/HON_KITANY_MARIANNE.jpg
HON. KITI RICHARD KEN CHONGA,ODM,KILIFI SOUTH,KILIFI,Elected,images/mps/HON_KITI_RICHARD_KEN_CHONGA.jpg
"HON. KITUR, BERNARD KIBOR",UDA,NANDI HILLS,NANDI,Elected,images/mps/HON_KITUR_BERNARD_KIBOR.jpg
"HON. KIUNJURI, MWANGI FESTUS",TSP,LAIKIPIA EAST,LAIKIPIA,Elected,images/mps/HON_KIUNJURI_MWANGI_FESTUS.jpg
HON. KOECH KIPNGETICH VICTOR,CCM,CHEPALUNGU,BOMET,Elected,images/mps/HON_KOECH_KIPNGETICH_VICTOR.jpg
"HON. KOECH, NELSON",UDA,BELGUT,KERICHO,Elected,images/mps/HON_KOECH_NELSON.jpg
HON. KOMBE HARRISON GARAMA,ODM,MAGARINI,KILIFI,Elected,images/mps/HON_KOMBE_HARRISON_GARAMA.jpg
HON. KOMINGOI KIBET KIRUI,UDA,BURETI,KERICHO,Elected,images/mps/HON_KOMINGOI_KIBET_KIRUI.jpg
HON. KORERE SARAH PAULATA,JP,LAIKIPIA NORTH,LAIKIPIA,Elected,images/mps/HON_KORERE_SARAH_PAULATA.jpg
HON. KORIR ADAMS KIPSANAI,UDA,KEIYO NORTH,ELGEYO-MARAKWET,Elected,images/mps/HON_KORIR_ADAMS_KIPSANAI.jpg
HON. KOSGEI HILARY KIPLANG’AT,UDA,KIPKELION WEST,KERICHO,Elected,images/mps/HON_KOSGEI_HILARY_KIPLANGAT.jpg
HON. KOYI JOHN WALUKE,JP,SIRISIA,BUNGOMA,Elected,images/mps/HON_KOYI_JOHN_WALUKE.jpg
HON. KUNO YAKUB ADOW,UPIA,BURA,TANA RIVER,Elected,images/mps/HON_KUNO_YAKUB_ADOW.jpg
"HON. KUNO, AMINA UDGOON SIYAD",JP,GARISSA,GARISSA,Elected,images/mps/HON_KUNO_AMINA_UDGOON_SIYAD.jpg
HON. KURURIA ELIJAH NJORE NJOROGE,IND,GATUNDU NORTH,KIAMBU,Elected,images/mps/HON_KURURIA_ELIJAH_NJORE_NJOROGE.jpg
HON. LEKUTON JOSEPH,UDM,LAISAMIS,MARSABIT,Elected,images/mps/HON_LEKUTON_JOSEPH.jpg
"HON. LELMENGIT, JOSSES KIPTOO KOSGEY",UDA,EMGWEN,NANDI,Elected,images/mps/HON_LELMENGIT_JOSSES_KIPTOO_KOSGEY.jpg
HON. LEMANKEN ARAMAT,UDA,NAROK EAST,NAROK,Elected,images/mps/HON_LEMANKEN_ARAMAT.jpg
HON. LENGURIS PAULINE,UDA,SAMBURU,SAMBURU,Elected,images/mps/HON_LENGURIS_PAULINE.jpg
"HON. LENTOIJONI, JACKSON LEKUMONTARE",KANU,SAMBURU EAST,SAMBURU,Elected,images/mps/HON_LENTOIJONI_JACKSON_LEKUMONTARE.jpg
"HON. LESUUDA, NAISULA",KANU,SAMBURU WEST,SAMBURU,Elected,images/mps/HON_LESUUDA_NAISULA.jpg
"HON. LETIPILA, DOMINIC ELI",UDA,SAMBURU NORTH,SAMBURU,Elected,images/mps/HON_LETIPILA_DOMINIC_ELI.jpg
"HON. LOCHAKAPONG, PETER",UDA,SIGOR,WEST POKOT,Elected,images/mps/HON_LOCHAKAPONG_PETER.jpg
HON. LOMWA JOSEPH SAMAL,JP,ISIOLO NORTH,ISIOLO NORTH,Elected,images/mps/HON_LOMWA_JOSEPH_SAMAL.jpg
HON. LOTEE TITUS,KUP,KACHELIBA,WEST POKOT,Elected,images/mps/HON_LOTEE_TITUS.jpg
"HON. LUYAI, CALEB AMISI",ODM,SABOTI,TRANS-NZOIA,,images/mps/HON_LUYAI_CALEB_AMISI.jpg
"HON. MAALIM, FARAH",WDM,DADAAB,GARISSA,Elected,images/mps/HON_MAALIM_FARAH.jpg
HON. MACHELE MOHAMED SOUD,ODM,MVITA,MOMBASA,Elected,images/mps/HON_MACHELE_MOHAMED_SOUD.jpg
HON. MAINA JANE NJERI,UDA,KIRINYAGA,KIRINYAGA,Elected,images/mps/HON_MAINA_JANE_NJERI.jpg
"HON. MAINA, BETTY NJERI",UDA,MURANG’A,MURANG’A,Elected,images/mps/HON_MAINA_BETTY_NJERI.jpg
HON. MAINGI MARY,UDA,MWEA,KIRINYAGA,Elected,images/mps/HON_MAINGI_MARY.jpg
HON. MAISORI MARWA KEMERO KITAYAMA,UDA,KURIA EAST,MIGORI,Elected,images/mps/HON_MAISORI_MARWA_KEMERO_KITAYAMA.jpg
"HON. MAJIMBO, KALASINGA",FORD-K,KABUCHAI,BUNGOMA,Elected,images/mps/HON_MAJIMBO_KALASINGA.jpg
HON. MAKALI JOHN OKWISIA,FORD-K,KANDUYI,BUNGOMA,Elected,images/mps/HON_MAKALI_JOHN_OKWISIA.jpg
"HON. MANDUKU, DANIEL OGWOKA",ODM,NYARIBARI MASABA,KISII,Elected,images/mps/HON_MANDUKU_DANIEL_OGWOKA.jpg
HON. MARUBU MUTHONI MONICAH,IND,LAMU,LAMU,Elected,images/mps/HON_MARUBU_MUTHONI_MONICAH.jpg
HON. MASARA PETER FRANCIS,ODM,SUNA WEST,MIGORI,Elected,images/mps/HON_MASARA_PETER_FRANCIS.jpg
"HON. MASITO, FATUMA HAMISI",ODM,KWALE,KWALE,Elected,images/mps/HON_MASITO_FATUMA_HAMISI.jpg
HON. MATHENGE DUNCAN MAINA,UDA,NYERI TOWN,NYERI,Elected,images/mps/HON_MATHENGE_DUNCAN_MAINA.jpg
HON. MAWATHE JULIUS MUSILI,,,,,images/mps/HON_MAWATHE_JULIUS_MUSILI.jpg
HON. MAYAKA IRENE NYAKERARIO,ODM,,,Nominated,images/mps/HON_MAYAKA_IRENE_NYAKERARIO.jpg
"HON. MBAI, NIMROD MBITHUKA",UDA,KITUI EAST,KITUI,Elected,images/mps/HON_MBAI_NIMROD_MBITHUKA.jpg
HON. MBALU JESSICA NDUKU KIKO,WDM,KIBWEZI EAST,MAKUENI,Elected,images/mps/HON_MBALU_JESSICA_NDUKU_KIKO.jpg
"HON. MBONI, DAVID MWALIKA",WDM,KITUI RURAL,KITUI,,images/mps/HON_MBONI_DAVID_MWALIKA.jpg
"HON. MBUI, ROBERT",WDM,KATHIANI,MACHAKOS,,images/mps/HON_MBUI_ROBERT.jpg
"HON. MELI, JULIUS KIPBIRWOT",UDA,TINDERET,NANDI,Elected,images/mps/HON_MELI_JULIUS_KIPBIRWOT.jpg
HON. MIZIGHI LYDIA HAIKA,UDA,TAITA TAVETA,TAITA-TAVETA,Elected,images/mps/HON_MIZIGHI_LYDIA_HAIKA.jpg
HON. MNYAZI AMINA LAURA,ODM,MALINDI,KILIFI,Elected,images/mps/HON_MNYAZI_AMINA_LAURA.jpg
HON. MOGAKA STEPHEN,JP,WEST MUGIRANGO,NYAMIRA,Elected,images/mps/HON_MOGAKA_STEPHEN.jpg
HON. MOHAMED ABDIKADIR HUSSEIN,ODM,LAGDERA,GARISSA,Elected,images/mps/HON_MOHAMED_ABDIKADIR_HUSSEIN.jpg
HON. MOHAMED ADEN DAUDI,JP,WAJIR EAST,WAJIR,Elected,images/mps/HON_MOHAMED_ADEN_DAUDI.jpg
HON. MOHAMED MOHAMED ALI,UDA,NYALI,MOMBASA,Elected,images/mps/HON_MOHAMED_MOHAMED_ALI.jpg
HON. MOHAMED UMULKHER HARUN,ODM,,,Nominated,images/mps/HON_MOHAMED_UMULKHER_HARUN.jpg
HON. MOHAMMED FATUMA ZAINAB,IND,MIGORI,MIGORI,Elected,images/mps/HON_MOHAMMED_FATUMA_ZAINAB.jpg
HON. MOHAMMED ZAMZAM CHIMBA,ODM,MOMBASA,MOMBASA,Elected,images/mps/HON_MOHAMMED_ZAMZAM_CHIMBA.jpg
HON. MOMANYI JERUSHA MONGINA,JP,NYAMIRA,NYAMIRA,Elected,images/mps/HON_MOMANYI_JERUSHA_MONGINA.jpg
HON. MREMBO IRENE NJOKI,JP,BAHATI,NAKURU,Elected,images/mps/HON_MREMBO_IRENE_NJOKI.jpg
"HON. MUCHIRA, MICHAEL MWANGI",UDA,OL JOROK,NYANDARUA,Elected,images/mps/HON_MUCHIRA_MICHAEL_MWANGI.jpg
HON. MUGABE INNOCENT MAINO,ODM,LIKUYANI,KAKAMEGA,Elected,images/mps/HON_MUGABE_INNOCENT_MAINO.jpg
HON. MUGE CYNTHIA JEPKOSGEI,UDA,NANDI,NANDI,,images/mps/HON_MUGE_CYNTHIA_JEPKOSGEI.jpg
HON. MUHANDA ELSIE BUSIHILE,ODM,KAKAMEGA,KAKAMEGA,Elected,images/mps/HON_MUHANDA_ELSIE_BUSIHILE.jpg
HON. MUHIA WANJIKU,UDA,KIPIPIRI,NYANDARUA,Elected,images/mps/HON_MUHIA_WANJIKU.jpg
HON. MUKHWANA TITUS KHAMALA,ODM,LURAMBI,KAKAMEGA,Elected,images/mps/HON_MUKHWANA_TITUS_KHAMALA.jpg
HON. MUKUNJI JOHN GITONGA MWANIKI,UDA,MANYATTA,EMBU,Elected,images/mps/HON_MUKUNJI_JOHN_GITONGA_MWANIKI.jpg
HON. MULANYA EKESA GEOFFREY,IND.,NAMBALE,BUSIA,Elected,images/mps/HON_MULANYA_EKESA_GEOFFREY.jpg
HON. MULE CALEB MUTISO,MCCP,MACHAKOS TOWN,MACHAKOS,Elected,images/mps/HON_MULE_CALEB_MUTISO.jpg
HON. MULE STEPHEN MUTINDA,WDM,MATUNGULU,MACHAKOS,Elected,images/mps/HON_MULE_STEPHEN_MUTINDA.jpg
HON. MULI FABIAN KYULE,GDDP,KANGUNDO,MACHAKOS,Elected,images/mps/HON_MULI_FABIAN_KYULE.jpg
HON. MULU MAKALI,WDM,KITUI CENTRAL,KITUI,Elected,images/mps/HON_MULU_MAKALI.jpg
"HON. MULYUNGI, GIDEON MUTEMI",WDM,MWINGI CENTRAL,MWINGI,Elected,images/mps/HON_MULYUNGI_GIDEON_MUTEMI.jpg
"HON. MUMO, ROSE MUSEO",WDM,MAKUENI,MAKUENI,,images/mps/HON_MUMO_ROSE_MUSEO.jpg
HON. MUNYORO JOSEPH KAMAU,UDA,KIGUMO,MURANG'A,Elected,images/mps/HON_MUNYORO_JOSEPH_KAMAU.jpg
HON. MUPE ANTHONY KENGA,PAA,RABAI,KILIFI,Elected,images/mps/HON_MUPE_ANTHONY_KENGA.jpg
HON. MURATHA ANNE WANJIKU MUGO,UDA,KIAMBU,KIAMBU,Elected,images/mps/HON_MURATHA_ANNE_WANJIKU_MUGO.jpg
HON. MURIU WAKILI EDWARD,UDA,GATANGA,MURANG'A,Elected,images/mps/HON_MURIU_WAKILI_EDWARD.jpg
HON. MURIUKI NEBART BERNARD,IND,MBEERE SOUTH,EMBU,Elected,images/mps/HON_MURIUKI_NEBART_BERNARD.jpg
HON. MURUGARA GEORGE GITONGA,UDA,THARAKA,THARAKA-NITHI,Elected,images/mps/HON_MURUGARA_GEORGE_GITONGA.jpg
"HON. MUSAU, VINCENT MUSYOKA",UDA,MWALA,MACHAKOS,Elected,images/mps/HON_MUSAU_VINCENT_MUSYOKA.jpg
HON. MUTAI KIPRONOH ALFRED,UDA,KURESOI NORTH,NAKURU,Elected,images/mps/HON_MUTAI_KIPRONOH_ALFRED.jpg
HON. MUTHAMA STANLEY MUIRURI,JP,LAMU WEST,LAMU,Elected,images/mps/HON_MUTHAMA_STANLEY_MUIRURI.jpg
"HON. MUTUA, DIDMUS WEKESA BARASA",UDA,KIMILILI,BUNGOMA,Elected,images/mps/HON_MUTUA_DIDMUS_WEKESA_BARASA.jpg
HON. MUTUSE ECKOMAS MWENGI,MCCP,KIBWEZI WEST,MAKUENI,Elected,images/mps/HON_MUTUSE_ECKOMAS_MWENGI.jpg
HON. MWAFRIKA AUGUSTINE KAMANDE,UDA,ROYSAMBU,NAIROBI,Elected,images/mps/HON_MWAFRIKA_AUGUSTINE_KAMANDE.jpg
HON. MWAGO AMOS MAINA,JP,STAREHE,NAIROBI,Elected,images/mps/HON_MWAGO_AMOS_MAINA.jpg
HON. MWAKUWONA DANSON MWASHAKO,WDM,WUNDANYI,TAITA TAVETA,Elected,images/mps/HON_MWAKUWONA_DANSON_MWASHAKO.jpg
HON. MWALE NICHOLAS SCOTT TINDI,ODM,BUTERE,KAKAMEGA,Elected,images/mps/HON_MWALE_NICHOLAS_SCOTT_TINDI.jpg
"HON. MWALYO, JOSHUA MBITHI",IND,MASINGA,MACHAKOS,Elected,images/mps/HON_MWALYO_JOSHUA_MBITHI.jpg
HON. MWANGI GEOFFREY WANDETO,UDA,TETU,NYERI,Elected,images/mps/HON_MWANGI_GEOFFREY_WANDETO.jpg
HON. MWANGI TERESIA WANJIRU,,,,,images/mps/HON_MWANGI_TERESIA_WANJIRU.jpg
HON. MWANYANJE GERTRUDE MBEYU,ODM,KILIFI,KILIFI,Elected,images/mps/HON_MWANYANJE_GERTRUDE_MBEYU.jpg
HON. MWENJE MARK SAMUEL MURIITHI,JP,EMBAKASI WEST,NAIROBI,Elected,images/mps/HON_MWENJE_MARK_SAMUEL_MURIITHI.jpg
HON. MWIRIGI JOHN PAUL,UDA,IGEMBE SOUTH,MERU,Elected,images/mps/HON_MWIRIGI_JOHN_PAUL.jpg
HON. NABII NABWERA DARAJA,ODM,LUGARI,KAKAMEGA,Elected,images/mps/HON_NABII_NABWERA_DARAJA.jpg
"HON. NABULINDO, PETER OSCAR",ODM,MATUNGU,KAKAMEGA,Elected,images/mps/HON_NABULINDO_PETER_OSCAR.jpg
HON. NAICCA JOHNSON MANYA,ODM,MUMIAS WEST,KAKAMEGA,Elected,images/mps/HON_NAICCA_JOHNSON_MANYA.jpg
HON. NAMUAR JOSEPH EMATHE,UDA,TURKANA CENTRAL,TURKANA,Elected,images/mps/HON_NAMUAR_JOSEPH_EMATHE.jpg
"HON. NANOK, DANIEL EPUYO",UDA,TURKANA WEST,TURKANA,Elected,images/mps/HON_NANOK_DANIEL_EPUYO.jpg
"HON. NDUNG’U, GEORGE KOIMBURI",UDA,JUJA,KIAMBU,Elected,images/mps/HON_NDUNGU_GEORGE_KOIMBURI.jpg
HON. NDUYO SUSAN NGUGI,TSP,THARAKA NITHI,THARAKA-NITHI,Elected,images/mps/HON_NDUYO_SUSAN_NGUGI.jpg
HON. NGANGA ALICE WAMBUI,UDA,THIKA TOWN,KIAMBU,Elected,images/mps/HON_NGANGA_ALICE_WAMBUI.jpg
HON. NGIKOLONG NICHOLAS NGIKOR NIXON,JP,TURKANA EAST,TURKANA,Elected,images/mps/HON_NGIKOLONG_NICHOLAS_NGIKOR_NIXON.jpg
"HON. NGITIT, CECILIA ASINYEN",UDA,TURKANA,TURKANA,Elected,images/mps/HON_NGITIT_CECILIA_ASINYEN.jpg
"HON. NGUNA, NGUSYA CHARLES",WDM,MWINGI WEST,KITUI,Elected,images/mps/HON_NGUNA_NGUSYA_CHARLES.jpg
HON. NGURO ONESMUS NGOGOYO,UDA,KAJIADO NORTH,KAJIADO,Elected,images/mps/HON_NGURO_ONESMUS_NGOGOYO.jpg
HON. NG’ELECHEI CAROLINE JEPTOO,IND.,ELGEYO MARAKWET,ELGEYO MARAKWET,Elected,images/mps/HON_NGELECHEI_CAROLINE_JEPTOO.jpg
HON. NJERU PAMELA NJOKI,UDA,EMBU,EMBU,Elected,images/mps/HON_NJERU_PAMELA_NJOKI.jpg
HON. NJOROGE MARY WAMAUA WAITHIRA,UDA,MARAGWA,MURANG'A,Elected,images/mps/HON_NJOROGE_MARY_WAMAUA_WAITHIRA.jpg
HON. NTUTU KITILAI OLE,IND,NAROK SOUTH,NAROK,Elected,images/mps/HON_NTUTU_KITILAI_OLE.jpg
HON. NTWIGA PATRICK MUNENE,UDA,CHUKA/IGAMBANG'OMBE,THARAKA-NITHI,Elected,images/mps/HON_NTWIGA_PATRICK_MUNENE.jpg
HON. NYAKUNDI JAPHETH MOKAYA,UDA,KITUTU CHACHE NORTH,KISII,Elected,images/mps/HON_NYAKUNDI_JAPHETH_MOKAYA.jpg
HON. NYAMAI RACHAEL KAKI,JP,KITUI SOUTH,KITUI,Elected,images/mps/HON_NYAMAI_RACHAEL_KAKI.jpg
HON. NYAMITA MARK OGOLLA,ODM,URIRI,MIGORI,Elected,images/mps/HON_NYAMITA_MARK_OGOLLA.jpg
"HON. NYAMOKO, JOASH NYAMACHE",UDA,NORTH MUGIRANGO,NYAMIRA,Elected,images/mps/HON_NYAMOKO_JOASH_NYAMACHE.jpg
HON. NYENZE EDITH VETHI,WDM,KITUI WEST,KITUI,Elected,images/mps/HON_NYENZE_EDITH_VETHI.jpg
HON. NYIKAL WAMBURA JAMES,ODM,SEME,KISUMU,Elected,images/mps/HON_NYIKAL_WAMBURA_JAMES.jpg
"HON. NYORO, SAMSON NDINDI",UDA,KIHARU,MURANG’A,Elected,images/mps/HON_NYORO_SAMSON_NDINDI.jpg
"HON. NZENGU, PAUL MUSYIMI",WDM,MWINGI NORTH,MWINGI,Elected,images/mps/HON_NZENGU_PAUL_MUSYIMI.jpg
HON. NZIOKA ERASTUS KIVASU,WDM,MBOONI,MAKUENI,Elected,images/mps/HON_NZIOKA_ERASTUS_KIVASU.jpg
HON. OBARA EVE AKINYI,ODM,KABONDO KASIPUL,HOMA BAY,Elected,https://f003.backblazeb2.com/file/serikali-images/mps/HON_OBARA_EVE_AKINYI.webp
"HON. OBIRI, INNOCENT MOMANYI",WDM,BOBASI,KISII,Elected,images/mps/HON_OBIRI_INNOCENT_MOMANYI.jpg
HON. OBO RUWEIDA MOHAMED,JP,LAMU EAST,LAMU,,images/mps/HON_OBO_RUWEIDA_MOHAMED.jpg
HON. OCHIENG DAVID OUMA,MDG,UGENYA,SIAYA,Elected,images/mps/HON_OCHIENG_DAVID_OUMA.jpeg
"HON. ODANGA, GEOFFREY MAKOKHA",ODM,MATAYOS,BUSIA,Elected,images/mps/HON_ODANGA_GEOFFREY_MAKOKHA.jpg
HON. ODEGE TOM MBOYA,ODM,NYATIKE,MIGORI,Elected,images/mps/HON_ODEGE_TOM_MBOYA.JPG
"HON. ODHIAMBO, ELISHA OCHIENG",ODM,GEM,SIAYA,,images/mps/HON_ODHIAMBO_ELISHA_OCHIENG.jpg
"HON. ODHIAMBO, MILLIE GRACE AKOTH",ODM,MBITA,HOMA BAY,Elected,https://f003.backblazeb2.com/file/serikali-images/mps/HON_ODHIAMBO_MILLIE_GRACE_AKOTH.webp
HON. OGOLLA. GIDEON OCHANDA,ODM,BONDO,SIAYA,Elected,images/mps/HON_OGOLLA_GIDEON_OCHANDA.jpg
"HON. OKELO, JARED ODOYO",ODM,NYANDO,KISUMU,Elected,images/mps/HON_OKELO_JARED_ODOYO.jpg
HON. OKUOME ADIPO ANDREW,ODM,KARACHUONYO,HOMA BAY,Elected,https://f003.backblazeb2.com/file/serikali-images/mps/HON_OKUOME_ADIPO_ANDREW.webp
"HON. OLUOCH, ANTHONY TOM",ODM,MATHARE,NAIROBI,Elected,images/mps/HON_OLUOCH_ANTHONY_TOM.jpg
"HON. OMANYO, CATHERINE NAKHABI",ODM,BUSIA,BUSIA,,images/mps/HON_OMANYO_CATHERINE_NAKHABI.jpg
HON. OMBAKA ODUOR CHRISTINE,ODM,SIAYA,SIAYA,Elected,images/mps/HON_OMBAKA_ODUOR_CHRISTINE.jpg
HON. OMBOKO MILEMBA,,EMUHAYA,VIHIGA,Elected,images/mps/HON_OMBOKO_MILEMBA.jpg
HON. OMONDI CAROLI,ODM,SUBA,HOMA BAY,Elected,https://f003.backblazeb2.com/file/serikali-images/mps/HON_OMONDI_CAROLI.webp
HON. OMWERA GEORGE ALDWA,ODM,MAKADARA,NAIROBI,Elected,images/mps/HON_OMWERA_GEORGE_ALDWA.jpg
