name,party,constituency,county,status,image_local_path
HON. ONCHOKE CHARLES MAMWACHA,UPA,BONCHARI,KISII,Elected,images/mps/HON_ONCHOKE_CHARLES_MAMWACHA.jpg
"HON. ONYIEGO, SILVANUS OSORO",UDA,SOUTH MUGIRANGO,KISII,Elected,images/mps/HON_ONYIEGO_SILVANUS_OSORO.jpg
"HON. ORERO, PETER OCHIENG",ODM,KIBRA,NAIROBI,Elected,images/mps/HON_ORERO_PETER_OCHIENG.jpg
HON. ORON JOSHUA ODONGO,ODM,KISUMU CENTRAL,KISUMU,Elected,images/mps/HON_ORON_JOSHUA_ODONGO.jpg
HON. OSERO PATRICK,ODM,BORABU,NYAMIRA COUNTY,Elected,images/mps/HON_OSERO_PATRICK.JPG
HON. OSOGO JOYCE ATIENO BENSUDA,ODM,HOMA BAY,HOMA BAY,Elected,images/mps/HON_OSOGO_JOYCE_ATIENO_BENSUDA.jpg
"HON. OTUCHO, MARY EMAASE",UDA,TESO SOUTH,BUSIA,Elected,images/mps/HON_OTUCHO_MARY_EMAASE.jpg
"HON. OUNDO, WILBERFORCE OJIAMBO",ODM,FUNYULA,BUSIA,Elected,images/mps/HON_OUNDO_WILBERFORCE_OJIAMBO.jpg
HON. OWINO JOHN WALTER,ODM,AWENDO,MIGORI,Elected,images/mps/HON_OWINO_JOHN_WALTER.jpg
"HON. OWINO, MARTIN PETERS",ODM,NDHIWA,HOMA BAY,Elected,https://f003.backblazeb2.com/file/serikali-images/mps/HON_OWINO_MARTIN_PETERS.webp
"HON. OWUOR, JOSHUA ADUMA",ODM,NYAKACH,KISUMU,Elected,https://f003.backblazeb2.com/file/serikali-images/mps/HON_OWUOR_JOSHUA_ADUMA.webp
"HON. OYOO, JAMES ONYANGO",ODM,MUHORONI,KISUMU,Elected,images/mps/HON_OYOO_JAMES_ONYANGO.jpg
"HON. OYUGI, DICK MAUNGU",DAP-K,LUANDA,VIHIGA,Elected,images/mps/HON_OYUGI_DICK_MAUNGU.jpg
"HON. OYULA, JOSEPH H. MAERO",ODM,BUTULA,BUNGOMA,,images/mps/HON_OYULA_JOSEPH_H_MAERO.jpg
HON. PARASHINA SAMUEL SAKIMBA,ODM,KAJIADO SOUTH,KAJIADO,Elected,images/mps/HON_PARASHINA_SAMUEL_SAKIMBA.jpg
HON. PAREYIO MANTAINE AGNES,JP,NAROK NORTH,NAROK,Elected,images/mps/HON_PAREYIO_MANTAINE_AGNES.jpg
HON. PASSARIS ESTHER MUTHONI,ODM,NAIROBI,NAIROBI,Elected,images/mps/HON_PASSARIS_ESTHER_MUTHONI.jpg
"HON. PKOSING, DAVID",KUP,POKOT SOUTH,POKOT,,images/mps/HON_PKOSING_DAVID.jpg
HON. RAI SAMUEL GONZI,PAA,KINANGO,KWALE,Elected,images/mps/HON_RAI_SAMUEL_GONZI.jpg
"Hon. Raso, Dido Ali",,Saku,,,images/mps/Hon_Raso_Dido_Ali.jpg
"HON. RASSO, COL (RTD) DIDO ALI",UDA,SAKU,MARSABIT,Elected,images/mps/HON_RASSO_COL_RTD_DIDO_ALI.jpg
HON. REUBEN KIBOREK,UDA,Mogotio,,,images/mps/HON_REUBEN_KIBOREK.jpg
"HON. ROBI, MATHIAS NYAMABE",UDA,KURIA WEST,MIGORI,Elected,images/mps/HON_ROBI_MATHIAS_NYAMABE.jpg
HON. SALASYA PETER KALERWA,DAP-K,MUMIAS EAST,KAKAMEGA,Elected,images/mps/HON_SALASYA_PETER_KALERWA.jpg
HON. SALIM FEISAL ABDALLAH BADER,UDA,MSAMBWENI,KWALE,,images/mps/HON_SALIM_FEISAL_ABDALLAH_BADER.jpg
HON. SANEY IBRAHIM ADBI,UDA,WAJIR NORTH,WAJIR,,images/mps/HON_SANEY_IBRAHIM_ADBI.jpg
HON. SANKAIRE LEAH SOPIATO,UDA,KAJIADO,KAJIADO,Elected,images/mps/HON_SANKAIRE_LEAH_SOPIATO.jpg
"HON. SERGON, JEMATIAH FLOWRENCE",UDA,BARINGO,BARINGO,Elected,images/mps/HON_SERGON_JEMATIAH_FLOWRENCE.jpg
HON. SHAKE MBOGHO PETER,JP,MWATATE,TAITA TAVETA,Elected,images/mps/HON_SHAKE_MBOGHO_PETER.jpg
HON. SHEIKH UMUL KER KASSIM,UDM,MANDERA,MANDERA,Elected,images/mps/HON_SHEIKH_UMUL_KER_KASSIM.jpg
HON. SHIMBWA OMAR MWINYI,ODM,CHANGAMWE,MOMBASA,Elected,images/mps/HON_SHIMBWA_OMAR_MWINYI.jpg
HON. SHINALI BERNARD MASAKA,ODM,IKOLOMANI,KAKAMEGA,Elected,images/mps/HON_SHINALI_BERNARD_MASAKA.jpg
HON. SHURIE ABDI OMAR,JP,BALAMBALA,GARISSA,Elected,images/mps/HON_SHURIE_ABDI_OMAR.jpg
"HON. SIGEI, FRANCIS KIPYEGON ARAP",UDA,SOTIK,BOMET,Elected,images/mps/HON_SIGEI_FRANCIS_KIPYEGON_ARAP.jpg
"HON. SIRMA, MUSA CHERUTICH",UDA,ELDAMA RAVINE,BARINGO,Elected,images/mps/HON_SIRMA_MUSA_CHERUTICH.jpg
HON. SITATI DANIEL WANYAMA,UDA,WEBUYE WEST,BUNGOMA,Elected,images/mps/HON_SITATI_DANIEL_WANYAMA.jpg
"HON. SITIENEI, JANET JEPKEMBOI",UDA,TURBO,UASIN GISHU,Elected,images/mps/HON_SITIENEI_JANET_JEPKEMBOI.jpg
HON. SIYOI LILLIAN CHEBET,UDA,TRANS NZOIA,TRANS NZOIA,Elected,images/mps/HON_SIYOI_LILLIAN_CHEBET.jpg
HON. SLOYA CLEMENT LOGOVA,UDA,SABATIA,VIHIGA,Elected,images/mps/HON_SLOYA_CLEMENT_LOGOVA.jpg
HON. SUDI OSCAR KIPCHUMBA,UDA,KAPSERET,UASIN GISHU,Elected,images/mps/HON_SUDI_OSCAR_KIPCHUMBA.jpg
HON. SULEKA HULBALE HARUN,UDM,,,Nominated,images/mps/HON_SULEKA_HULBALE_HARUN.jpg
"HON. SUNKUIYA, GEORGE RISA",UDA,KAJIADO WEST,KAJIADO,Elected,images/mps/HON_SUNKUIYA_GEORGE_RISA.jpg
"HON. SUNKULI, JULIUS LEKAKENY",KANU,KILGORIS,NAROK,Elected,images/mps/HON_SUNKULI_JULIUS_LEKAKENY.jpg
HON. TAITAMU JULIUS MÁNAIBA,UDA,IGEMBE NORTH,MERU,Elected,images/mps/HON_TAITAMU_JULIUS_MÁNAIBA.jpg
HON. TANDAZA KASSIM SAWA,ANC,MATUGA,KWALE,Elected,images/mps/HON_TANDAZA_KASSIM_SAWA.jpg
HON. THUKU ZACHARY KWENYA,JP,KINANGOP,NYANDARUA,Elected,images/mps/HON_THUKU_ZACHARY_KWENYA.jpg
"HON. TONGOYO, GABRIEL KOSHAL",UDA,NAROK WEST,NAROK,Elected,images/mps/HON_TONGOYO_GABRIEL_KOSHAL.jpg
HON. TONKEI REBECCA NOONAISHI,UDA,NAROK,NAROK,Elected,images/mps/HON_TONKEI_REBECCA_NOONAISHI.jpg
HON. TONUI JOSEPH KIPKOSGEI,UDA,KURESOI SOUTH,NAKURU,Elected,images/mps/HON_TONUI_JOSEPH_KIPKOSGEI.jpg
HON. TOROITICH TIMOTHY KIPCHUMBA,IND,MARAKWET WEST,ELGEYO MARAKWET,Elected,images/mps/HON_TOROITICH_TIMOTHY_KIPCHUMBA.jpg
HON. TUNGULE CHARO KENNETH KAZUNGU,PAA,GANZE,KILIFI,Elected,images/mps/HON_TUNGULE_CHARO_KENNETH_KAZUNGU.jpg
"HON. WACHIRA, RAHAB MUKAMI",UDA,NYERI,NYERI,,images/mps/HON_WACHIRA_RAHAB_MUKAMI.jpg
HON. WAINAINA ANTHONY NJOROGE,UDA,KIENI,NYERI,Elected,images/mps/HON_WAINAINA_ANTHONY_NJOROGE.jpg
"HON. WAINAINA, MICHAEL WAMBUGU",UDA,OTHAYA,NYERI,Elected,images/mps/HON_WAINAINA_MICHAEL_WAMBUGU.jpg
HON. WAITHAKA JOHN MACHUA,UDA,KIAMBU,KIAMBU,Elected,images/mps/HON_WAITHAKA_JOHN_MACHUA.jpg
HON. WAMACUKURU JAMES GITHUA KAMAU,UDA,KABETE,KIAMBU,Elected,images/mps/HON_WAMACUKURU_JAMES_GITHUA_KAMAU.jpg
HON. WAMBILIANGA CATHERINE NANJALA,FORD-K,BUNGOMA,BUNGOMA,Elected,images/mps/HON_WAMBILIANGA_CATHERINE_NANJALA.jpg
HON. WAMBOKA WANAMI JACK NELSON,DAP-K,BUMULA,BUNGOMA,Elected,images/mps/HON_WAMBOKA_WANAMI_JACK_NELSON.jpg
"HON. WAMUCHOMBA, GATHONI",UDA,GITHUNGURI,KIAMBU,Elected,images/mps/HON_WAMUCHOMBA_GATHONI.jpg
HON. WANGAYA CHRISTOPHER ASEKA,ODM,KHWISERO,KAKAMEGA,Elected,images/mps/HON_WANGAYA_CHRISTOPHER_ASEKA.jpg
"HON. WANGWE, EMMANUEL",ODM,NAVAKHOLO,KAKAMEGA,Elected,images/mps/HON_WANGWE_EMMANUEL.jpg
HON. WANJALA RAPHAEL BITTA SAUTI,ODM,BUDALANGI,BUSIA,Elected,images/mps/HON_WANJALA_RAPHAEL_BITTA_SAUTI.jpg
HON. WANJIKU JOHN NJUGUNA,UDA,KIAMBAA,KIAMBU,Elected,images/mps/HON_WANJIKU_JOHN_NJUGUNA.jpg
"HON. WANJIRA, MARTHA WANGARI",UDA,GILGIL,NAKURU,Elected,images/mps/HON_WANJIRA_MARTHA_WANGARI.jpg
HON. WANYONYI KEVIN FERDINAND,FORD-K,KWANZA,TRANS NZOIA,Elected,images/mps/HON_WANYONYI_KEVIN_FERDINAND.jpg
HON. WANYONYI MARTIN PEPELA,FORD-K,WEBUYE EAST,BUNGOMA,Elected,images/mps/HON_WANYONYI_MARTIN_PEPELA.jpg
HON. WAQO NAOMI JILLO,UDA,MARSABIT,MARSABIT,Elected,images/mps/HON_WAQO_NAOMI_JILLO.jpg
"HON. WAWERU, JOHN KIARIE",UDA,DAGORETTI SOUTH,NAIROBI,Elected,images/mps/HON_WAWERU_JOHN_KIARIE.jpg
HON. WETANGULA TIMOTHY WANYONYI,ODM,WESTLANDS,NAIROBI,Elected,images/mps/HON_WETANGULA_TIMOTHY_WANYONYI.jpg
HON. YEGON BRIGHTON LEONARD,UDA,KONOIN,BOMET,,images/mps/HON_YEGON_BRIGHTON_LEONARD.jpg
"HON. YEGON, RICHARD KIPKEMOI",UDA,BOMET EAST,BOMET,Elected,images/mps/HON_YEGON_RICHARD_KIPKEMOI.jpg
"HON. YUSSUF, ADAN HAJI",UDM,MANDERA WEST,MANDERA,Elected,images/mps/HON_YUSSUF_ADAN_HAJI.jpg
HON.(CPA) KIMANI FRANCIS KURIA,UDA,MOLO,NAKURU,Elected,images/mps/HONCPA_KIMANI_FRANCIS_KURIA.jpg
HON.KARITHO KIILI DANIEL,JP,IGEMBE CENTRAL,MERU,Elected,images/mps/HONKARITHO_KIILI_DANIEL.jpg
HON.MBIUKI JAPHET MIRITI KAREKE,UDA,MAARA,THARAKA-NITHI,Elected,images/mps/HONMBIUKI_JAPHET_MIRITI_KAREKE.jpg
VACANT,,GARISSA TOWNSHIP,GARISSA,,images/mps/VACANT.png
VACANT,,KANDARA,MURANGA,,images/mps/VACANT_1.png
